Track ID,Track Name,Album Name,Artist Name(s),Release Date,Duration (ms),Popularity,Added By,Added At,Genres,Record Label,Danceability,Energy,Key,Loudness,Mode,Speechiness,Acousticness,Instrumentalness,Liveness,Valence,Tempo,Time Signature
7bNu99D6mj3Cyg1gmYnfpO,"Light Ocean Waves for Quiet Contemplation and Personal Wellness","Relaxing Sounds of Nature and Ambient Healing for Mediation, Relaxation, Sound Therapy and Deep Sleep","Sounds of Nature Relaxation",2011-07-19,360071,0,bezoing,2017-02-21T13:18:58Z,"","Hot Ideas",0.179,0.999,6,-18.748,1,0.052,0.8,0.917,0.925,0.00001,77.196,4
2riIa193j2RJXZCtnQ0FIo,"Ocean Waves Coming In","50 Ocean Sounds","Outside Broadcast Recordings",2015-08-01,176848,0,bezoing,2017-02-21T13:18:58Z,"","Fierce Music",0.0862,0.997,1,-14.672,1,0.0667,0.414,0.232,0.666,0.00001,167.029,3
2Yfhikj4xZD3xFoIGVjO95,"Ocean Waves with Birds","50 Ocean Sounds","Outside Broadcast Recordings",2015-08-01,361586,0,bezoing,2017-02-21T13:18:58Z,"","Fierce Music",0.0766,0.999,6,-10.852,0,0.0798,0.0268,0.79,0.377,0.0079,78.41,4
6JIxACDi2naS9X2JaJGxms,"Calming Tranquil Sea - Bonus Track","Ambient Nature Sounds","Nature Sounds",2013-05-31,599506,5,bezoing,2017-02-21T13:18:58Z,"","Paradise Music Ltd",0.177,0.813,5,-30.148,1,0.0527,0.953,0.714,0.489,0.00001,89.12,3
3mvZjm6l0UeYlQCR8IkPJt,"Tropical Hawaiian Beach","Ambient Nature Sounds","Nature Sounds",2013-05-31,596626,3,bezoing,2017-02-21T13:18:58Z,"","Paradise Music Ltd",0.0951,0.746,5,-29.988,1,0.0619,0.958,0.763,0.691,0.00001,90.048,1
5vw16SA4XfJCPfXO1VoDgb,"High Seas","Massive Ambient Music, Vol.1","Ambient Realms",2015-03-16,473760,8,bezoing,2017-02-21T13:18:58Z,"ambient,dark ambient","Independent",0.179,0.82,0,-16.689,0,0.284,0.0862,0.95,0.126,0.0368,169.293,3
0l39onggqZsXxtn2wkdOpD,"Storm on Boat (Insomnia Treatment)","Noises - Different Calming Sounds, Grey & White Ambient Shades of Nature, Machine & Weather Noise, Natural Healing Collection","Natural Sounds Music Academy",2017-10-19,180000,7,bezoing,2017-10-24T16:32:47Z,"","Silence Meditation Records",0.157,0.998,11,-14.983,0,0.0709,0.688,0.989,0.132,0.00001,79.058,4
6y8yYAzwAkPVdOz7MOI9hP,"Across the Waves","Tranquil Tides","Sea of Thieves",2021-04-16,3600000,21,bezoing,2021-04-21T13:46:44Z,"sea shanties,pirate metal","Microsoft",0.227,0.995,1,-19.578,1,0.0789,0.244,0.947,0.691,0.00729,109.272,3
